,name,size,price,unit_price,on_sale,norm_unit_price,norm_unit_price_type,norm_size,norm_size_type
104,CHI-CHI'S CHIPS & TORTILLAS Flour Taco Style Tortillas - 12 Count,12 oz,2 for $4.00,$0.17/oz,True,0.00599647266313933,wt,340.20000000000005,wt
105,Ortega Flour Tortillas,14 oz,2 for $5.00,$0.18/oz,True,0.006349206349206348,wt,396.90000000000003,wt
106,Mission Small Fajita Flour Tortillas,9.2 oz,$2.39,$0.26/oz,False,0.009171075837742505,wt,56.7,wt
107,Chi-Chi's Foldables Flour Tortillas - 8 Pack,13.28 oz,2 for $4.00,$0.15/oz,True,0.005291005291005291,wt,793.8000000000001,wt
108,Mission Flour Tortillas Large Burrito,16 each,$5.99,$0.37,False,0.37,whole,16.0,whole
109,"Old El Paso Flour Tortilla Shells, 8 Ct, 5.3 oz",5.3 oz,$2.79,$0.53/oz,False,0.01869488536155203,wt,85.05000000000001,wt
110,Giant Eagle Soft Taco Flour Tortillas,10 ct,$1.99,$0.20/each,False,0.2,whole,10.0,whole
111,Giant Eagle Fajita Flour Tortillas,10 ct,$1.39,$0.14/each,False,0.14,whole,10.0,whole
112,La Banderita Flour Tortillas - Family Pack,22.5 oz,$3.19,$0.14/oz,False,0.0049382716049382715,wt,141.75,wt
113,Giant Eagle Family Size Soft Taco Size Flour Tortillas,20 ct,$3.79,$0.19/each,False,0.19,whole,20.0,whole
114,Giant Eagle Whole Wheat Soft Taco Flour Tortillas,10 ct,$1.49,$0.15/each,False,0.15,whole,10.0,whole
115,Mission Carb Balance Soft Taco Flour Tortillas - Medium,340 g,$5.79,$0.02/g,False,0.02,whole,340.0,whole
116,Nature's Basket Organic Basil,0.75 oz,$2.99,$3.99/oz,False,0.14074074074074075,wt,2126.25,wt
117,Produce Living Organic Basil,1 ct,$2.99,$2.99/each,False,2.99,whole,1.0,whole
118,Chef Basil,4 oz,$4.99,$1.25/oz,False,0.04409171075837742,wt,113.4,wt
119,Simply Organic Basil,0.54 oz,$4.99,$9.24/oz,False,0.3259259259259259,wt,1530.9,wt
120,Nature's Basket Organic Basil,2 oz,$3.99,$2.00/oz,False,0.07054673721340388,wt,56.7,wt
121,Market District Sweet Basil,0.21 oz,$4.79,$22.81/oz,False,0.8045855379188712,wt,595.35,wt
122,Mezzetta Napa Valley Homemade Sauce Tomato & Sweet Basil,25 oz,$6.49,$0.26/oz,False,0.009171075837742505,wt,708.75,wt
123,Silver Palate San Marzano Blend Tomato Basil,25 oz,$4.99,$0.20/oz,False,0.007054673721340388,wt,708.75,wt
124,Classico Sauce & Spread - Traditional Basil Pesto,8.1 oz,$3.29,$0.41/oz,False,0.014462081128747794,wt,28.35,wt
125,BUITONI Pesto with Basil - 7oz,7 oz,$5.99,$0.86/oz,False,0.030335097001763667,wt,198.45000000000002,wt
126,Giant Eagle Tomato Basil Pasta Sauce,24 oz,$1.19,$0.05/oz,False,0.001763668430335097,wt,680.4000000000001,wt
127,Barilla Tomato & Basil Pasta Sauce,24 oz,$2.49,$0.10/oz,True,0.003527336860670194,wt,680.4000000000001,wt
128,Classico Pasta Sauce - Tomato & Basil,680 g,$2.50,$0.00/g,False,0.0,whole,680.0,whole
129,Del Grosso Spaghetti Sauce - Tomato Basil,26 oz,$1.69,$0.07/oz,False,0.0024691358024691358,wt,737.1,wt
130,BUITONI Pesto with Basil - Reduced Fat,7 oz,$5.99,$0.86/oz,False,0.030335097001763667,wt,198.45000000000002,wt
131,Del Monte Tomatoes - Diced With Basil Garlic & Oregano,14.5 oz,$1.25,$0.09/oz,False,0.003174603174603174,wt,141.75,wt
132,Mission Sun-Dried Tomato Basil Wraps,425 g,$3.99,$0.01/g,False,0.01,whole,425.0,whole
133,Hunt's Diced Tomatoes With Basil Garlic And Oregano,14.5 oz,$1.39,$0.10/oz,False,0.003527336860670194,wt,141.75,wt
134,Al Fresco Tomato & Basil Chicken Meatballs,12 oz,$4.99,$0.42/oz,True,0.014814814814814814,wt,340.20000000000005,wt
135,Athenos Crumbled Tomato & Basil Feta Cheese,6 oz,$4.49,$0.75/oz,False,0.026455026455026454,wt,170.10000000000002,wt
0,Meat Ground Beef Chuck 80% Lean,1.6 lb (avg.),$7.18 avg/ea,$4.49/lb,False,0.009898589065255732,wt,2721.6000000000004,wt
1,Meat 96% Lean Ground Beef,1.1 lb (avg.),$7.69 avg/ea,$6.99/lb,False,0.01541005291005291,wt,453.6,wt
2,Giant Eagle Ground Beef Chuck - Value Pack 80% Lean,3 lb (avg.),$11.97 avg/ea,$3.99/lb,True,0.008796296296296297,wt,1360.8000000000002,wt
3,Market District 80% Lean Ground Beef Burgers,1 lb (avg.),$5.59 avg/ea,$5.59/lb,False,0.012323633156966489,wt,453.6,wt
4,Market District 85% Lean Ground Beef Burgers,0.25 lb,$5.99/lb,$5.99/lb,False,0.013205467372134039,wt,11340.0,wt
5,Market District 90% Lean Ground Beef Burgers,1 lb (avg.),$6.59 avg/ea,$6.59/lb,False,0.01452821869488536,wt,453.6,wt
6,Giant Eagle 93% Lean Ground Beef,1 lb (avg.),$6.49 avg/ea,$6.49/lb,False,0.014307760141093475,wt,453.6,wt
7,Thomas Farms Organic Grass Fed Ground Beef,1 lb,$4.99,$4.99/lb,True,0.011000881834215168,wt,453.6,wt
8,Giant Eagle 85% Lean Ground Beef,3 lb (avg.),$11.97 avg/ea,$3.99/lb,True,0.008796296296296297,wt,1360.8000000000002,wt
9,Market District 80% Lean Certified Angus Ground Beef Chuck,0.25 lb,$3.99/lb,$3.99/lb,True,0.008796296296296297,wt,11340.0,wt
10,Giant Eagle 93% Lean Ground Beef - Value Pack,3.1 lb (avg.),$18.57 avg/ea,$5.99/lb,True,0.013205467372134039,wt,453.6,wt
11,Nature's Basket 90% Lean Ground Beef,1.2 lb (avg.),$8.39 avg/ea,$6.99/lb,False,0.01541005291005291,wt,907.2,wt
12,Tajima 80% Lean Kobe Ground Beef,16 oz,$5.99,$0.37/oz,True,0.013051146384479717,wt,453.6,wt
13,Giant Eagle 73% Lean Ground Beef,1.2 lb (avg.),$4.79 avg/ea,$3.99/lb,False,0.008796296296296297,wt,907.2,wt
14,Giant Eagle 73% Lean Ground Beef - Value Pack,3.1 lb (avg.),$10.82 avg/ea,$3.49/lb,True,0.00769400352733686,wt,453.6,wt
15,Market District Beef Ground Sirloin,0.25 lb,$6.99/lb,$6.99/lb,False,0.01541005291005291,wt,11340.0,wt
16,Market District Beef Ground Round,0.25 lb,$6.59/lb,$6.59/lb,False,0.01452821869488536,wt,11340.0,wt
17,Giant Eagle 85% Lean Ground Beef Chuck Patties,1 lb (avg.),$4.49 avg/ea,$4.49/lb,True,0.009898589065255732,wt,453.6,wt
18,Meat Ground Veal,1 lb (avg.),$6.99 avg/ea,$6.99/lb,False,0.01541005291005291,wt,453.6,wt
19,Gardein The Ultimate Beefless Ground,13.7 oz,$3.99,$0.29/oz,True,0.010229276895943561,wt,198.45000000000002,wt
20,Giant Eagle Large Eggs,12 ct,$0.79,$0.07/each,True,0.07,whole,12.0,whole
21,Giant Eagle Large Eggs,18 ct,$1.19,$0.07/each,False,0.07,whole,18.0,whole
22,Giant Eagle Large Eggs,6 ct,$0.39,$0.07/each,False,0.07,whole,6.0,whole
23,Eggland's Best Large White Eggs,18 ct,$4.49,$0.25/each,False,0.25,whole,18.0,whole
24,Giant Eagle Extra Large Eggs,12 ct,$0.99,$0.08/each,False,0.08,whole,12.0,whole
25,NestFresh Free Range Brown Large Eggs,12 ct,$4.49,$0.37/each,False,0.37,whole,12.0,whole
26,Eggland's Best Large White Eggs,12 ct,$3.29,$0.27/each,False,0.27,whole,12.0,whole
27,Nature's Basket Large Brown Eggs,12 ct,$3.79,$0.32/each,False,0.32,whole,12.0,whole
28,Eggland's Best Extra Large White Grade A Eggs,12 ct,$3.49,$0.29/each,False,0.29,whole,12.0,whole
29,Nature's Basket Large Cage Free Brown Eggs,1 ct,2 for $4.00,$2.00/each,True,2.0,whole,1.0,whole
30,Nature's Basket Large Brown Cage Free Eggs,18 ct,$5.99,$0.33/each,False,0.33,whole,18.0,whole
31,Eggland's Best Eggs - Grade A Large Brown,1 doz,$3.99,$3.99/doz,False,3.99,whole,0.0,wt
32,Eggland's Best Brown Eggs - Organic Grade A Large,1 doz,$4.99,$4.99/doz,False,4.99,whole,0.0,wt
33,Pete & Gerry's Organic Large Brown Eggs,1 doz,$5.99,$5.99/doz,False,5.99,whole,0.0,wt
34,Nature's Basket Large White Eggs,12 ct,$2.49,$0.21/each,False,0.21,whole,12.0,whole
35,Organic Valley Omega-3 Organic Large Brown Eggs,12 oz,$3.49,$0.29/oz,False,0.010229276895943561,wt,340.20000000000005,wt
36,Nellie's Free Range Large Brown Eggs,12 ct,$4.29,$0.36/each,False,0.36,whole,12.0,whole
37,Nature's Basket Organic Large Cage Free Brown Eggs,1 ct,$4.29,$4.29/each,False,4.29,whole,1.0,whole
38,Davidson's Eggs - Pasteurized Shell Large Safest Choice,24 oz,$3.99,$0.17/oz,False,0.00599647266313933,wt,680.4000000000001,wt
39,Giant Eagle Eggs - Omega 3 Large,1 ct,$3.49,$3.49/each,False,3.49,whole,1.0,whole
40,Nature's Basket Organic Basil,0.75 oz,$2.99,$3.99/oz,False,0.14074074074074075,wt,2126.25,wt
41,Produce Living Organic Basil,1 ct,$2.99,$2.99/each,False,2.99,whole,1.0,whole
42,Chef Basil,4 oz,$4.99,$1.25/oz,False,0.04409171075837742,wt,113.4,wt
43,Simply Organic Basil,0.54 oz,$4.99,$9.24/oz,False,0.3259259259259259,wt,1530.9,wt
44,Nature's Basket Organic Basil,2 oz,$3.99,$2.00/oz,False,0.07054673721340388,wt,56.7,wt
45,Market District Sweet Basil,0.21 oz,$4.79,$22.81/oz,False,0.8045855379188712,wt,595.35,wt
46,Mezzetta Napa Valley Homemade Sauce Tomato & Sweet Basil,25 oz,$6.49,$0.26/oz,False,0.009171075837742505,wt,708.75,wt
47,Silver Palate San Marzano Blend Tomato Basil,25 oz,$4.99,$0.20/oz,False,0.007054673721340388,wt,708.75,wt
48,Classico Sauce & Spread - Traditional Basil Pesto,8.1 oz,$3.29,$0.41/oz,False,0.014462081128747794,wt,28.35,wt
49,BUITONI Pesto with Basil - 7oz,7 oz,$5.99,$0.86/oz,False,0.030335097001763667,wt,198.45000000000002,wt
50,Giant Eagle Tomato Basil Pasta Sauce,24 oz,$1.19,$0.05/oz,False,0.001763668430335097,wt,680.4000000000001,wt
51,Barilla Tomato & Basil Pasta Sauce,24 oz,$2.49,$0.10/oz,True,0.003527336860670194,wt,680.4000000000001,wt
52,Classico Pasta Sauce - Tomato & Basil,680 g,$2.50,$0.00/g,False,0.0,whole,680.0,whole
53,Del Grosso Spaghetti Sauce - Tomato Basil,26 oz,$1.69,$0.07/oz,False,0.0024691358024691358,wt,737.1,wt
54,BUITONI Pesto with Basil - Reduced Fat,7 oz,$5.99,$0.86/oz,False,0.030335097001763667,wt,198.45000000000002,wt
55,Del Monte Tomatoes - Diced With Basil Garlic & Oregano,14.5 oz,$1.25,$0.09/oz,False,0.003174603174603174,wt,141.75,wt
56,Mission Sun-Dried Tomato Basil Wraps,425 g,$3.99,$0.01/g,False,0.01,whole,425.0,whole
57,Hunt's Diced Tomatoes With Basil Garlic And Oregano,14.5 oz,$1.39,$0.10/oz,False,0.003527336860670194,wt,141.75,wt
58,Al Fresco Tomato & Basil Chicken Meatballs,12 oz,$4.99,$0.42/oz,True,0.014814814814814814,wt,340.20000000000005,wt
59,Athenos Crumbled Tomato & Basil Feta Cheese,6 oz,$4.49,$0.75/oz,False,0.026455026455026454,wt,170.10000000000002,wt
60,Giant Eagle Thick Cut Sliced Bacon,16 oz,2 for $7.00,$0.22/oz,True,0.007760141093474426,wt,453.6,wt
61,Giant Eagle Sliced Bacon,16 oz,2 for $7.00,$0.22/oz,True,0.007760141093474426,wt,453.6,wt
62,Sugardale Bacon,16 oz,$5.99,$0.37/oz,False,0.013051146384479717,wt,453.6,wt
63,Sugardale Bacon,12 oz,$4.49,$0.37/oz,False,0.013051146384479717,wt,340.20000000000005,wt
64,Sugardale Thick Bacon,16 oz,$5.99,$0.37/oz,False,0.013051146384479717,wt,453.6,wt
65,Oscar Mayer Bacon - Center Cut Original,12 oz,$8.49,$0.71/oz,False,0.025044091710758373,wt,340.20000000000005,wt
66,Giant Eagle Applewood Sliced Bacon,16 oz,2 for $7.00,$0.22/oz,True,0.007760141093474426,wt,453.6,wt
67,Giant Eagle Hardwood Smoked Bacon,15 ct,$3.99,$0.27/each,False,0.27,whole,15.0,whole
68,Giant Eagle Lower Sodium Sliced Bacon,16 oz,2 for $7.00,$0.22/oz,True,0.007760141093474426,wt,453.6,wt
69,Sugardale Low Sodium Bacon,16 oz,$5.99,$0.37/oz,False,0.013051146384479717,wt,453.6,wt
70,Oscar Mayer Bacon - Naturally Hardwood Smoked,16 oz,$8.49,$0.53/oz,False,0.01869488536155203,wt,453.6,wt
71,Smithfield Hometown Original Bacon,340 g,$4.99,$0.01/g,False,0.01,whole,340.0,whole
72,Market District Smokehouse Bacon,16 oz,$6.99,$0.44/oz,False,0.015520282186948852,wt,453.6,wt
73,Sugardale Center Cut Bacon,12 oz,$5.99,$0.50/oz,False,0.01763668430335097,wt,340.20000000000005,wt
74,Sugardale Bacon-Thin,1 lb,$5.99,$5.99/lb,False,0.013205467372134039,wt,453.6,wt
75,Coleman All Natural Bacon - Hickory Smoked,12 oz,$6.99,$0.58/oz,False,0.020458553791887123,wt,340.20000000000005,wt
76,Oscar Mayer Fully Cooked 100% Real Bacon,2.52 oz,$4.99,$1.98/oz,False,0.06984126984126984,wt,1474.2,wt
77,Nature's Basket Uncured Bacon,12 oz,$6.59,$0.55/oz,False,0.019400352733686066,wt,340.20000000000005,wt
78,Wright Brand Thick Sliced Hickory Smoked Bacon,1.5 lb,$12.99,$8.66/lb,False,0.019091710758377425,wt,2268.0,wt
79,Hormel Original Bacon Microwave Ready Black Label,12 oz,$8.99,$0.75/oz,False,0.026455026455026454,wt,340.20000000000005,wt
80,Giant Eagle Medium Mexican Style Salsa,16 oz,$3.99,$0.25/oz,False,0.008818342151675485,wt,453.6,wt
81,Chi-Chi's Restaurant Style Medium Salsa,16 oz,$2.49,$0.16/oz,False,0.00564373897707231,wt,453.6,wt
82,Giant Eagle Medium Shells,16 oz,$0.89,$0.06/oz,False,0.002116402116402116,wt,453.6,wt
83,TOSTITOS Chunky Salsa Medium,15.5 oz,$3.79,$0.24/oz,False,0.008465608465608464,wt,141.75,wt
84,Giant Eagle Thick & Chunky Medium Salsa,15 oz,$1.99,$0.13/oz,False,0.004585537918871252,wt,425.25,wt
85,TOSTITOS Salsa Con Queso - Medium,15 oz,$3.99,$0.27/oz,False,0.009523809523809525,wt,425.25,wt
86,Pace® Medium Chunky Salsa,16 oz,2 for $4.00,$0.13/oz,True,0.004585537918871252,wt,453.6,wt
87,Barilla Medium Shells Pasta,16 oz,4 for $5.00,$0.08/oz,True,0.002821869488536155,wt,453.6,wt
88,Giant Eagle Garbage Bag Eight Gallons Medium,20 ct,$2.99,$0.15/each,False,0.15,whole,20.0,whole
89,Giant Eagle Salsa Con Queso - Medium,15 oz,$3.49,$0.23/oz,False,0.008112874779541446,wt,425.25,wt
90,Starbucks Unsweetened Medium Roast Iced Coffee,48 fl oz,$4.99,$0.10/fl oz,False,0.003381805884342239,vol,1419.3600000000001,vol
91,Pace® The Original Medium Picante Sauce,16 oz,2 for $4.00,$0.13/oz,True,0.004585537918871252,wt,453.6,wt
92,Giant Eagle Medium Eggs,12 ct,$0.69,$0.06/each,False,0.06,whole,12.0,whole
93,Nature's Basket Organic Medium Salsa,16 oz,$2.49,$0.16/oz,False,0.00564373897707231,wt,453.6,wt
94,TOSTITOS Salsa Con Queso - Medium,23 oz,$4.99,$0.22/oz,False,0.007760141093474426,wt,652.0500000000001,wt
95,Chi-Chi's Salsa - Fiesta Thick & Chunky Medium,48 oz,$6.29,$0.13/oz,True,0.004585537918871252,wt,1360.8000000000002,wt
96,Starbucks Breakfast Blend Medium Ground Coffee,12 oz,$8.99,$0.75/oz,True,0.026455026455026454,wt,340.20000000000005,wt
97,TOSTITOS Restaurant Style Salsa - Medium,15.5 oz,$3.79,$0.24/oz,False,0.008465608465608464,wt,141.75,wt
98,Newman's Own Salsa - Bandito Medium,16 oz,$3.29,$0.21/oz,False,0.007407407407407407,wt,453.6,wt
99,Giant Eagle Medium Egg Noodles,12 oz,$1.19,$0.10/oz,False,0.003527336860670194,wt,340.20000000000005,wt
100,Giant Eagle Spaghetti,16 oz,$0.89,$0.06/oz,False,0.002116402116402116,wt,453.6,wt
101,Giant Eagle Elbow Macaroni,16 oz,$0.89,$0.06/oz,False,0.002116402116402116,wt,453.6,wt
102,Giant Eagle Angel Hair,16 oz,$0.89,$0.06/oz,False,0.002116402116402116,wt,453.6,wt
103,Giant Eagle Cheese Stuffed Tortellini,19 oz,$2.59,$0.14/oz,False,0.0049382716049382715,wt,538.65,wt
104,Giant Eagle Wide Egg Noodles,12 oz,$1.19,$0.10/oz,False,0.003527336860670194,wt,340.20000000000005,wt
105,Giant Eagle Penne Rigate,16 oz,$0.89,$0.06/oz,False,0.002116402116402116,wt,453.6,wt
106,Light 'n Fluffy Egg Noodles - Wide Enriched,12 oz,$2.29,$0.19/oz,False,0.006701940035273368,wt,340.20000000000005,wt
107,Barilla Penne Pasta,16 oz,4 for $5.00,$0.08/oz,True,0.002821869488536155,wt,453.6,wt
108,Barilla Spaghetti Pasta,16 oz,4 for $5.00,$0.08/oz,True,0.002821869488536155,wt,453.6,wt
109,Giant Eagle Thin Spaghetti,16 oz,$0.89,$0.06/oz,False,0.002116402116402116,wt,453.6,wt
110,Maruchan Noodles - Yakisoba Japanese Home-Style,4 oz,$1.00,$0.25/oz,True,0.008818342151675485,wt,113.4,wt
111,Mrs. Miller's Noodles - Wide,16 oz,$3.49,$0.22/oz,False,0.007760141093474426,wt,453.6,wt
112,Skinny Pasta Noodle,9.52 oz,$3.29,$0.35/oz,False,0.012345679012345678,wt,1474.2,wt
113,Light 'n Fluffy Egg Noodles - Extra Wide Enriched,12 oz,$2.29,$0.19/oz,False,0.006701940035273368,wt,340.20000000000005,wt
114,Light 'n Fluffy Egg Noodles - Medium Enriched,340 g,$2.29,$0.01/g,False,0.01,whole,340.0,whole
115,Giant Eagle Extra Broad Egg Noodles,12 oz,$1.19,$0.10/oz,False,0.003527336860670194,wt,340.20000000000005,wt
116,Giant Eagle Medium Egg Noodles,12 oz,$1.19,$0.10/oz,False,0.003527336860670194,wt,340.20000000000005,wt
117,Amish Kitchens Egg Noodles - Extra Wide,12 oz,$2.49,$0.21/oz,False,0.007407407407407407,wt,340.20000000000005,wt
118,Annie Chun's Rice Noodles - Pad Thai,8 oz,$4.79,$0.60/oz,False,0.021164021164021163,wt,226.8,wt
119,La Choy Rice Noodles,3 oz,$1.99,$0.66/oz,False,0.02328042328042328,wt,85.05000000000001,wt
120,Hatch Peeled Green Chiles - Diced - Mild - Flame Roasted,4 oz,$1.99,$0.50/oz,False,0.01763668430335097,wt,113.4,wt
121,Kuner's Pintos & Chiles,453 g,$1.99,$0.00/g,False,0.0,whole,453.0,whole
122,La Victoria Diced Green Chiles - Fire Roasted - Mild,4 oz,$1.99,$0.50/oz,False,0.01763668430335097,wt,113.4,wt
123,Ortega Fire Roasted Diced Green Mild Chiles,4 oz,$1.19,$0.30/oz,True,0.010582010582010581,wt,113.4,wt
124,Giant Eagle Diced Green Chiles Mild,4 oz,$0.95,$0.24/oz,False,0.008465608465608464,wt,113.4,wt
125,"Old El Paso Chopped Green Chiles, 4.5 oz",4.5 oz,$1.69,$0.38/oz,False,0.013403880070546737,wt,141.75,wt
126,Amy's Chile Relleno Bowl,9 oz,$4.79,$0.53/oz,True,0.01869488536155203,wt,255.15,wt
127,Del Monte Tomatoes - Diced With Zesty Mild Green Chiles,14.5 oz,$1.25,$0.09/oz,False,0.003174603174603174,wt,141.75,wt
128,Desert Pepper Trading Company Chile Con Queso - Medium,16 oz,$3.99,$0.25/oz,True,0.008818342151675485,wt,453.6,wt
129,Doritos Dinamita Chile Limon Rolled Tortilla Chips,11.25 oz,$4.29,$0.38/oz,False,0.013403880070546737,wt,708.75,wt
130,Doritos Dinamita Chile Limon Tortilla Chips,4.25 oz,$1.89,$0.44/oz,False,0.015520282186948852,wt,708.75,wt
131,Fresh Quince - Chile,1 ct,$2.99,$2.99/each,False,2.99,whole,1.0,whole
132,Frontera Green Chile Enchilada Sauce,8 oz,$2.99,$0.37/oz,False,0.013051146384479717,wt,226.8,wt
133,Frontera Red Chile Enchilada Sauce,8 oz,$2.99,$0.37/oz,False,0.013051146384479717,wt,226.8,wt
134,Green Mountain Gringo Salsa - Roasted Chile Pepper Medium,16 oz,$5.79,$0.36/oz,False,0.012698412698412697,wt,453.6,wt
135,Harvest Snaps Mango Chile Lime Black Bean Crisps,3 oz,$2.49,$0.83/oz,False,0.029276895943562607,wt,85.05000000000001,wt
136,Kuner's of Colorado Refried Black Beans with Roasted Chiles,15.5 oz,$1.99,$0.13/oz,False,0.004585537918871252,wt,141.75,wt
137,La Victoria Enchilada Sauce - Green Chile,10 oz,$1.99,$0.20/oz,False,0.007054673721340388,wt,283.5,wt
138,Las Palmas Medium Green Chile Enchilada Sauce,28 oz,$3.99,$0.14/oz,False,0.0049382716049382715,wt,793.8000000000001,wt
139,LEAN CUISINE Cheese and Fire Roasted Chile Tamale,9.88 oz,3 for $10.00,$0.34/oz,True,0.01199294532627866,wt,2494.8,wt
0,Giant Eagle 85% Lean Ground Beef,3 lb (avg.),$11.97 avg/ea,$3.99/lb,True,0.008796296296296297,wt,1360.8000000000002,wt
1,Giant Eagle Ground Beef Chuck - Value Pack 80% Lean,3 lb (avg.),$11.97 avg/ea,$3.99/lb,True,0.008796296296296297,wt,1360.8000000000002,wt
2,Giant Eagle 93% Lean Ground Beef - Value Pack,3.1 lb (avg.),$18.57 avg/ea,$5.99/lb,True,0.013205467372134039,wt,453.6,wt
3,Market District Beef Loin Filet Mignon Steak,0.4 lb (avg.),$8.00 avg/ea,$19.99/lb,False,0.04406966490299823,wt,1814.4,wt
4,Market District Signature Beef Loin Semi Boneless Strip Steak,3 lb (avg.),$32.97 avg/ea,$10.99/lb,True,0.024228395061728393,wt,1360.8000000000002,wt
5,Giant Eagle 93% Lean Ground Beef,1 lb (avg.),$6.49 avg/ea,$6.49/lb,False,0.014307760141093475,wt,453.6,wt
6,Meat Ground Beef Chuck 80% Lean,1.6 lb (avg.),$7.18 avg/ea,$4.49/lb,False,0.009898589065255732,wt,2721.6000000000004,wt
7,Giant Eagle 85% Lean Ground Beef Chuck Patties,1 lb (avg.),$4.49 avg/ea,$4.49/lb,True,0.009898589065255732,wt,453.6,wt
8,Market District London Broil Top Round,2.5 lb (avg.),$14.98 avg/ea,$5.99/lb,True,0.013205467372134039,wt,2268.0,wt
9,Giant Eagle T-Bone Steaks Value Pack,2.4 lb (avg.),$19.18 avg/ea,$7.99/lb,True,0.01761463844797178,wt,1814.4,wt
10,Giant Eagle Lean Beef for Stew - Value Pack,1 lb (avg.),$6.49 avg/ea,$6.49/lb,True,0.014307760141093475,wt,453.6,wt
11,Market District Boneless Roast Beef,2.5 lb (avg.),$14.98 avg/ea,$5.99/lb,True,0.013205467372134039,wt,2268.0,wt
12,Market District Shoulder Roast - Certified Angus Beef,2.4 lb (avg.),$14.38 avg/ea,$5.99/lb,True,0.013205467372134039,wt,1814.4,wt
13,Market District Beef Rib Delmonico Steak,1 lb (avg.),$15.99 avg/ea,$15.99/lb,False,0.03525132275132275,wt,453.6,wt
14,Market District Sirloin Tip Roast - Certified Angus Beef,2 lb (avg.),$11.98 avg/ea,$5.99/lb,True,0.013205467372134039,wt,907.2,wt
15,Thomas Farms Organic Grass Fed Ground Beef,1 lb,$4.99,$4.99/lb,True,0.011000881834215168,wt,453.6,wt
16,Market District Filet Mignon Steak,0.5 lb,$19.99/lb,$19.99/lb,False,0.04406966490299823,wt,2268.0,wt
17,Meat 96% Lean Ground Beef,1.1 lb (avg.),$7.69 avg/ea,$6.99/lb,False,0.01541005291005291,wt,453.6,wt
18,Meat Boneless Bottom Round Beef Roast,2.5 lb (avg.),$14.98 avg/ea,$5.99/lb,True,0.013205467372134039,wt,2268.0,wt
19,Giant Eagle Beef Loin Porterhouse Steak - Value Pack,2 lb (avg.),$16.98 avg/ea,$8.49/lb,True,0.018716931216931215,wt,907.2,wt
20,Produce Ginger Root,0.25 lb,$4.49/lb,$4.49/lb,False,0.009898589065255732,wt,11340.0,wt
21,Market District Ginger,2.37 oz,$4.79,$2.02/oz,False,0.07125220458553791,wt,1048.95,wt
22,Simply Organic Ginger,1.64 oz,$5.79,$3.53/oz,False,0.12451499118165783,wt,1814.4,wt
23,Spice World Squeeze Ginger,10 oz,$4.79,$0.48/oz,False,0.01693121693121693,wt,283.5,wt
24,Giant Eagle Dried Crystallized Ginger,7 oz,$3.49,$0.50/oz,False,0.01763668430335097,wt,198.45000000000002,wt
25,McCormick Ground Ginger,0.7 oz,$5.49,$7.84/oz,False,0.2765432098765432,wt,198.45000000000002,wt
26,McCormick Gourmet Organic Crystallized Ginger,2 oz,$9.99,$5.00/oz,False,0.1763668430335097,wt,56.7,wt
27,Sushi Chef Pickled Ginger,6 fl oz,$4.29,$0.72/fl oz,False,0.024349002367264116,vol,177.42000000000002,vol
28,Sushic Sushi Ginger,1 ct,$0.99,$0.99/each,False,0.99,whole,1.0,whole
29,The Ginger People Crystallized Ginger,3.5 oz,$2.59,$0.74/oz,False,0.026102292768959433,wt,141.75,wt
30,Wel-Pac Sushi Ginger,11.5 fl oz,$4.99,$0.43/fl oz,False,0.014541765302671626,vol,147.85,vol
31,Canada Dry Diet Ginger Ale - 12 Pack Cans,144 fl oz,$5.79,$0.04/fl oz,False,0.0013527223537368955,vol,4258.08,vol
32,Canada Dry Ginger Ale - 2 Liter,67.6 fl oz,$2.29,$0.03/fl oz,False,0.0010145417653026716,vol,177.42000000000002,vol
33,Canada Dry Ginger Ale - 8 Pack Bottles,96 fl oz,$5.79,$0.06/fl oz,False,0.002029083530605343,vol,2838.7200000000003,vol
34,Giant Eagle Ginger Ale,12 ct,2 for $6.00,$0.25/each,True,0.25,whole,12.0,whole
35,Seagram's Ginger Ale,67.6 fl oz,$2.29,$0.03/fl oz,False,0.0010145417653026716,vol,177.42000000000002,vol
36,Canada Dry Ginger Ale - 6 Pack Cans,45 fl oz,$3.29,$0.07/fl oz,False,0.0023672641190395673,vol,1330.65,vol
37,Stauffer's Ginger Snaps,14 oz,$1.99,$0.14/oz,True,0.0049382716049382715,wt,396.90000000000003,wt
38,Seagram's Ginger Ale,144 fl oz,$5.79,$0.04/fl oz,False,0.0013527223537368955,vol,4258.08,vol
39,Canada Dry Ginger Ale - 6 Pack Bottles,101.44 fl oz,$4.29,$0.04/fl oz,True,0.0013527223537368955,vol,1301.08,vol
40,Produce Green Onions,1 ct,$0.99,$0.99/each,False,0.99,whole,1.0,whole
41,Produce Green Peppers,8 oz (avg.),$1.25 avg/ea,$2.49/lb,False,0.005489417989417989,wt,226.8,wt
42,Giant Eagle Life's Getting Fresher Green Beans,12 oz,$3.99,$0.33/oz,False,0.01164021164021164,wt,340.20000000000005,wt
43,Giant Eagle Diced Green Onions,4 oz,$2.99,$0.75/oz,False,0.026455026455026454,wt,113.4,wt
44,Del Monte Green Beans - Cut Blue Lake,14.5 oz,3 for $4.00,$0.09/oz,True,0.003174603174603174,wt,141.75,wt
45,Fresh Organic Green Onion,1 ct,$2.49,$2.49/each,False,2.49,whole,1.0,whole
46,Birds Eye Green Beans - Cut,1 lb,$1.50,$1.50/lb,False,0.0033068783068783067,wt,453.6,wt
47,Produce Collard Greens,16 oz (avg.),$1.99 avg/ea,$1.99/lb,False,0.004387125220458554,wt,453.6,wt
48,Greenline Organic 12 oz Green Beans,10 oz,$4.99,$0.50/oz,False,0.01763668430335097,wt,283.5,wt
49,Del Monte Green Beans - Cut Blue Lake No Salt Added,14.5 oz,3 for $4.00,$0.09/oz,True,0.003174603174603174,wt,141.75,wt
50,Pearls Pimiento Stuffed Spanish Green Olives - 4 Cups,6.4 oz,$4.29,$0.67/oz,False,0.0236331569664903,wt,113.4,wt
51,Arizona Green Tea With Ginseng and Honey,128 fl oz,3 for $10.00,$0.03/fl oz,True,0.0010145417653026716,vol,3784.96,vol
52,Market District Green Goddess Dressing,11.8 oz,$2.99,$0.25/oz,False,0.008818342151675485,wt,226.8,wt
53,Green Giant Steamers Antioxidant Vegetable Blend,7 oz,3 for $5.00,$0.24/oz,True,0.008465608465608464,wt,198.45000000000002,wt
54,Produce Green Beans,0.25 lb,$1.99/lb,$1.99/lb,False,0.004387125220458554,wt,11340.0,wt
55,Giant Eagle Veggi-Green Cut Green Beans,14.5 oz,$0.49,$0.03/oz,False,0.001058201058201058,wt,141.75,wt
56,Giant Eagle Cut Green Beans,8 oz,$0.45,$0.06/oz,False,0.002116402116402116,wt,226.8,wt
57,Del Monte Green Beans - Cut Blue Lake - 6 Pack,87 oz,$7.49,$0.09/oz,False,0.003174603174603174,wt,2466.4500000000003,wt
58,Birds Eye Premium Whole Green Beans,10.8 oz,$2.79,$0.26/oz,False,0.009171075837742505,wt,226.8,wt
59,Giant Eagle Original Diced Tomatoes & Green Chilies,10 oz,$1.00,$0.10/oz,False,0.003527336860670194,wt,283.5,wt
60,Lamagna Part Skim Ricotta Cheese,24 oz,$3.99,$0.17/oz,False,0.00599647266313933,wt,680.4000000000001,wt
61,Giant Eagle Part Skim Ricotta Cheese,15 oz,$1.79,$0.12/oz,True,0.004232804232804232,wt,425.25,wt
62,Lamagna Ricotta Cheese,16 oz,$2.99,$0.19/oz,False,0.006701940035273368,wt,453.6,wt
63,Giant Eagle Part Skim Natural Ricotta Cheese,24 oz,$2.99,$0.12/oz,False,0.004232804232804232,wt,680.4000000000001,wt
64,Giant Eagle Whole Milk Natural Ricotta Cheese,24 oz,$2.99,$0.12/oz,False,0.004232804232804232,wt,680.4000000000001,wt
65,Giant Eagle Whole Milk Ricotta Cheese,15 oz,$1.79,$0.12/oz,True,0.004232804232804232,wt,425.25,wt
66,Giant Eagle Whole Milk Ricotta Cheese,46 oz,$5.49,$0.12/oz,False,0.004232804232804232,wt,1304.1000000000001,wt
67,Breakstone's Cottage Doubles - Peach,133 g,$1.25,$0.01/g,False,0.01,whole,133.0,whole
68,Breakstone's Cottage Doubles - Pineapple,133 g,$1.25,$0.01/g,False,0.01,whole,133.0,whole
69,Giant Eagle Original Small Curd Cottage Cheese,16 oz,$1.99,$0.12/oz,False,0.004232804232804232,wt,453.6,wt
70,Daisy Cottage Cheese,1.5 lb,$3.49,$2.33/lb,False,0.00513668430335097,wt,2268.0,wt
71,Breakstone's Cottage Cheese - Lowfat Small Curd,24 oz,$3.99,$0.17/oz,False,0.00599647266313933,wt,680.4000000000001,wt
72,Breakstone's Cottage Cheese - Small Curd,24 oz,$3.99,$0.17/oz,False,0.00599647266313933,wt,680.4000000000001,wt
73,Breakstone's Cottage Doubles - Blueberry,133 g,$1.25,$0.01/g,False,0.01,whole,133.0,whole
