,name,size,price,unit_price,on_sale,norm_unit_price,norm_unit_price_type,norm_size,norm_size_type
37,Sagely Naturals CBD Relief & Recovery Cream,4 oz,$34.99,$8.75/oz,False,0.30864197530864196,wt,113.4,wt
38,Sagely Naturals CBD Relief & Recovery Cream,2 oz,$19.99,$10.00/oz,False,0.3527336860670194,wt,56.7,wt
39,Sagely Naturals CBD Relief & Recovery Roll On,0.33 oz,$29.99,$90.88/oz,False,3.2056437389770718,wt,935.5500000000001,wt
40,Fresh Express Baby Spinach,5 oz,$3.50,$0.70/oz,False,0.024691358024691357,wt,141.75,wt
41,Nature's Basket Organic Baby Spinach,5 oz,2 for $6.00,$0.60/oz,True,0.021164021164021163,wt,141.75,wt
42,Nature's Basket Organic Baby Spinach,16 oz,$5.99,$0.37/oz,False,0.013051146384479717,wt,453.6,wt
43,Farmer's Market Baby Spinach,6 oz,$3.00,$0.50/oz,False,0.01763668430335097,wt,170.10000000000002,wt
44,Giant Eagle Life's Getting Fresher Fresh Flat Leaf Spinach,10 oz,$2.29,$0.23/oz,False,0.008112874779541446,wt,283.5,wt
45,Birds Eye Spinach - Chopped,10 oz,$1.79,$0.18/oz,False,0.006349206349206348,wt,283.5,wt
46,Giant Eagle Cooking Spinach,16 oz,$3.99,$0.25/oz,False,0.008818342151675485,wt,453.6,wt
47,Nature's Basket Organic Spinach Medley,5 oz,2 for $6.00,$0.60/oz,True,0.021164021164021163,wt,141.75,wt
48,Produce Spinach,16 oz (avg.),$2.99 avg/ea,$2.99/lb,False,0.006591710758377425,wt,453.6,wt
49,Green Giant Steamers Chopped Spinach,9 oz,3 for $5.00,$0.19/oz,True,0.006701940035273368,wt,255.15,wt
50,Del Monte Fresh Cut Leaf Spinach,13.5 oz,3 for $4.00,$0.10/oz,True,0.003527336860670194,wt,141.75,wt
51,Giant Eagle Spinach Leaf - Box,10 oz,$1.39,$0.14/oz,False,0.0049382716049382715,wt,283.5,wt
52,Del Monte Spinach - Fresh Cut Chopped,13.5 oz,3 for $4.00,$0.10/oz,True,0.003527336860670194,wt,141.75,wt
53,Giant Eagle Baby Spinach,10 oz,$5.99,$0.60/oz,False,0.021164021164021163,wt,283.5,wt
54,Nature's Basket Organic Frozen Baby Spinach,16 oz,$2.79,$0.17/oz,False,0.00599647266313933,wt,453.6,wt
55,Birds Eye Steamfresh Superfood Blends Chickpeas & Spinach,283.5 g,$2.99,$0.01/g,True,0.01,whole,283.0,whole
56,Birds Eye Steamfresh Superfood Blends Quinoa & Spinach,10 oz,$2.99,$0.30/oz,True,0.010582010582010581,wt,283.5,wt
57,"Eatsmart Naturals Potato, Tomato & Spinach",6 oz,$4.99,$0.83/oz,False,0.029276895943562607,wt,170.10000000000002,wt
58,Gerber Teethers Strawberry Apple Spinach,1.7 oz,$3.29,$1.94/oz,False,0.06843033509700176,wt,198.45000000000002,wt
59,"Happy Baby Organic Clearly Crafted Pears, Kale & Spinach",4 oz,$1.79,$0.45/oz,False,0.015873015873015872,wt,113.4,wt
60,Produce Jumbo White Onions,16 oz (avg.),$1.99 avg/ea,$1.99/lb,False,0.004387125220458554,wt,453.6,wt
61,Produce White Peeled Onion,16 oz (avg.),$2.99 avg/ea,$2.99/lb,False,0.006591710758377425,wt,453.6,wt
62,Birds Eye Onions - Deluxe Vegetables White Pearl,14.4 oz,$2.79,$0.19/oz,False,0.006701940035273368,wt,113.4,wt
63,Melissa's Pearl Onions - White,10 oz,$4.49,$0.45/oz,False,0.015873015873015872,wt,283.5,wt
64,Giant Eagle Farm Raised Salmon Fillet,0.25 lb,$7.99/lb,$7.99/lb,True,0.01761463844797178,wt,11340.0,wt
65,Giant Eagle Sweet Thai Chili Fillet Salmon,1 ct,$10.99,$10.99/each,True,10.99,whole,1.0,whole
66,Giant Eagle Sweet Bourbon Salmon Fillet,1 ct,$10.99,$10.99/each,True,10.99,whole,1.0,whole
67,Orca Bay Wild Alaskan Sockeye Salmon Fillets,10 oz,$10.99,$1.10/oz,False,0.03880070546737213,wt,283.5,wt
68,Gorton's Classic Grilled Salmon Fillets,179 g,$5.49,$0.03/g,False,0.03,whole,179.0,whole
69,Gorton's Simply Bake Roasted Garlic & Butter Salmon Fillets,8.2 oz,$8.99,$1.10/oz,False,0.03880070546737213,wt,56.7,wt
0,Sweet Onions,20 oz (avg.),$1.24 avg/ea,$0.99/lb,True,0.0021825396825396826,wt,567.0,wt
1,Produce Yellow Onions,6 oz (avg.),$0.75 avg/ea,$1.99/lb,False,0.004387125220458554,wt,170.10000000000002,wt
2,Produce Red Onions,14 oz (avg.),$1.74 avg/ea,$1.99/lb,False,0.004387125220458554,wt,396.90000000000003,wt
3,Produce Sweet Onions,14 oz (avg.),$0.87 avg/ea,$0.99/lb,True,0.0021825396825396826,wt,396.90000000000003,wt
4,Produce Spanish Onion,14 oz (avg.),$1.74 avg/ea,$1.99/lb,False,0.004387125220458554,wt,396.90000000000003,wt
5,Fresh Organic Green Onion,1 ct,$2.49,$2.49/each,False,2.49,whole,1.0,whole
6,Produce Green Onions,1 ct,$0.99,$0.99/each,False,0.99,whole,1.0,whole
7,Produce Jumbo White Onions,16 oz (avg.),$1.99 avg/ea,$1.99/lb,False,0.004387125220458554,wt,453.6,wt
8,Giant Eagle Diced Sweet Onion,8 oz,$2.99,$0.37/oz,False,0.013051146384479717,wt,226.8,wt
9,Fresh Organic Yellow Onion,9 oz (avg.),$1.40 avg/ea,$2.49/lb,False,0.005489417989417989,wt,255.15,wt
10,Birds Eye Onions - Deluxe Vegetables White Pearl,14.4 oz,$2.79,$0.19/oz,False,0.006701940035273368,wt,113.4,wt
11,Produce Yellow Onion,5 lb,$4.49,$0.90/lb,False,0.001984126984126984,wt,2268.0,wt
12,Giant Eagle Diced Yellow Onion,8 oz,$2.99,$0.37/oz,False,0.013051146384479717,wt,226.8,wt
13,Produce White Peeled Onion,16 oz (avg.),$2.99 avg/ea,$2.99/lb,False,0.006591710758377425,wt,453.6,wt
14,Produce Organic Onion - Yellow,3 lb,$3.99,$1.33/lb,False,0.002932098765432099,wt,1360.8000000000002,wt
15,Giant Eagle Diced Red Onion,8 oz,$2.99,$0.37/oz,False,0.013051146384479717,wt,226.8,wt
16,Mrs. T's Classic Onion,16 oz,$3.29,$0.21/oz,False,0.007407407407407407,wt,453.6,wt
17,Giant Eagle Sliced Sweet Onion,7 oz,2 for $5.00,$0.36/oz,True,0.012698412698412697,wt,198.45000000000002,wt
18,Produce Organic Jumbo Red Onion,16 oz,$2.49,$0.16/oz,False,0.00564373897707231,wt,453.6,wt
19,Lipton Soup and Dip Mix Beefy Onion,2.2 oz,$1.79,$0.81/oz,False,0.02857142857142857,wt,56.7,wt
20,Produce Limes,1 ct,2 for $1.00,$0.50/each,True,0.5,whole,1.0,whole
21,Bai Bogota Blackberry Lime,11.5 fl oz,$1.79,$0.16/fl oz,False,0.005410889414947582,vol,147.85,vol
22,Bai Lambari Watermelon Lime,11.5 fl oz,$1.79,$0.16/fl oz,False,0.005410889414947582,vol,147.85,vol
23,Mountain Dew Kickstart Energizing Mango Lime,16 fl oz,$1.49,$0.09/fl oz,False,0.0030436252959080146,vol,473.12,vol
24,Polar Cranberry Lime,144 fl oz,3 for $9.00,$0.02/fl oz,True,0.0006763611768684477,vol,4258.08,vol
25,Protes Protein Chips Spicy Chili Lime,4 oz,$3.49,$0.87/oz,False,0.030687830687830688,wt,113.4,wt
26,Zevia Zero Calorie Lemon Lime with Bitters Mixer,45 fl oz,$4.99,$0.11/fl oz,False,0.0037199864727764627,vol,1330.65,vol
27,Produce Persian Seedless Limes,2 lb,$3.99,$2.00/lb,False,0.004409171075837742,wt,907.2,wt
28,Farmers Market Plastic Limes 100% Juice,4.5 oz,$0.99,$0.22/oz,False,0.007760141093474426,wt,141.75,wt
29,Giant Eagle Lime 100% Juice,15 fl oz,$2.00,$0.13/fl oz,False,0.004396347649644911,vol,443.55,vol
30,Nellie & Joe's Key West Lime Juice,16 fl oz,$3.79,$0.24/fl oz,False,0.008116334122421373,vol,473.12,vol
31,Sicilia Lime Juice,4 fl oz,$1.39,$0.35/fl oz,False,0.011836320595197835,vol,118.28,vol
32,Minute Maid Premium Limeade,12 fl oz,$2.29,$0.19/fl oz,False,0.006425431180250254,vol,354.84000000000003,vol
33,Gatorade G Series Lemon-Lime - 8 Pack,160 fl oz,2 for $11.00,$0.03/fl oz,True,0.0010145417653026716,vol,4731.2,vol
34,Farmers Market Plastic Limes 100% Juice,8 oz,$1.89,$0.24/oz,False,0.008465608465608464,wt,226.8,wt
35,Dannon Key Lime Yogurt Nonfat,5.3 oz,$1.00,$0.19/oz,False,0.006701940035273368,wt,85.05000000000001,wt
36,Yoplait Whips! Key Lime Pie Flavored Yogurt,4 oz,$0.75,$0.19/oz,False,0.006701940035273368,wt,113.4,wt
37,Chobani Greek Yogurt - Key Lime Blend,21.2 oz,$4.29,$0.20/oz,False,0.007054673721340388,wt,56.7,wt
38,Jell-O Gelatin Dessert - Lime,3 oz,$1.25,$0.42/oz,False,0.014814814814814814,wt,85.05000000000001,wt
39,Oikos Key Lime Greek Yogurt,5.3 oz,$1.00,$0.19/oz,False,0.006701940035273368,wt,85.05000000000001,wt
40,Produce Yellow Onions,6 oz (avg.),$0.75 avg/ea,$1.99/lb,False,0.004387125220458554,wt,170.10000000000002,wt
41,Fresh Organic Yellow Onion,9 oz (avg.),$1.40 avg/ea,$2.49/lb,False,0.005489417989417989,wt,255.15,wt
42,Produce Yellow Onion,5 lb,$4.49,$0.90/lb,False,0.001984126984126984,wt,2268.0,wt
43,Giant Eagle Diced Yellow Onion,8 oz,$2.99,$0.37/oz,False,0.013051146384479717,wt,226.8,wt
44,Farmer's Market Onion Yellow 3 Lb Usa,3 lb,$2.99,$1.00/lb,False,0.002204585537918871,wt,1360.8000000000002,wt
45,Produce Organic Onion - Yellow,3 lb,$3.99,$1.33/lb,False,0.002932098765432099,wt,1360.8000000000002,wt
46,Produce Yellow Onions Bag,2 lb,$3.99,$2.00/lb,False,0.004409171075837742,wt,907.2,wt
47,Produce Organic Onion Yellows,48 oz,$3.99,$0.08/oz,False,0.002821869488536155,wt,1360.8000000000002,wt
48,Season Brand Capers,3.5 oz,$3.79,$1.08/oz,False,0.0380952380952381,wt,141.75,wt
49,Giuliano Imported Nonpareil Capers,4 oz,$2.99,$0.75/oz,False,0.026455026455026454,wt,113.4,wt
50,Alessi Nonpareille Capers in White Balsamic Vinegar,3.5 fl oz,$2.49,$0.71/fl oz,True,0.024010821778829895,vol,147.85,vol
51,Crosse & Blackwell 100% Non-Pareil Capers,3 oz,$4.29,$1.43/oz,False,0.05044091710758377,wt,85.05000000000001,wt
52,"Goya Manzanilla Olives, Pimentos, & Capers",8 oz,$2.59,$0.32/oz,False,0.01128747795414462,wt,226.8,wt
53,Goya Spanish Capers,3.25 oz,$3.49,$1.07/oz,False,0.037742504409171075,wt,708.75,wt
54,Mediterranean Organic Organic Wild Capers - Non - Pareil,3.5 oz,$3.79,$1.08/oz,False,0.0380952380952381,wt,141.75,wt
55,Black Pearls Sliced Ripe Black Olives,2.25 oz,$2.19,$0.97/oz,False,0.03421516754850088,wt,708.75,wt
56,Giant Eagle Olives - Ripe Sliced,2.25 oz,$1.79,$0.80/oz,False,0.02821869488536155,wt,708.75,wt
57,Bell View Olives - Bucket Manzanilla,5.75 oz,$2.49,$0.43/oz,False,0.015167548500881834,wt,2126.25,wt
58,Bell View Olives - Salad,18 fl oz,$5.49,$0.31/fl oz,False,0.01048359824146094,vol,532.26,vol
59,Bell View Olives - Stuffed Manzanilla,10 oz,$4.49,$0.45/oz,False,0.015873015873015872,wt,283.5,wt
60,Delallo Deli Fresh Olive Jubilee,7 oz,$4.99,$0.71/oz,True,0.025044091710758373,wt,198.45000000000002,wt
61,Delallo Deli Fresh Pitted Olive Gigante,7 oz,$4.99,$0.71/oz,True,0.025044091710758373,wt,198.45000000000002,wt
62,Delallo Extra Large Ripe Olives,6 oz,$2.59,$0.43/oz,False,0.015167548500881834,wt,170.10000000000002,wt
63,Delallo Olives,5.75 oz,$2.59,$0.45/oz,False,0.015873015873015872,wt,2126.25,wt
64,Giant Eagle Olives - Jumbo Ripe Pitted,5.75 oz,$1.89,$0.33/oz,False,0.01164021164021164,wt,2126.25,wt
65,Giant Eagle Olives - Large Ripe Pitted,6 oz,$1.89,$0.32/oz,False,0.01128747795414462,wt,170.10000000000002,wt
66,Giant Eagle Olives - Medium Ripe Pitted,3.25 oz,$1.59,$0.49/oz,False,0.01728395061728395,wt,708.75,wt
67,Giant Eagle Olives - Medium Ripe Pitted,6 oz,$1.89,$0.32/oz,False,0.01128747795414462,wt,170.10000000000002,wt
68,Produce Green Peppers,8 oz (avg.),$1.25 avg/ea,$2.49/lb,False,0.005489417989417989,wt,226.8,wt
69,Cauliflower Green,1 each,$3.99,$3.99,False,3.99,whole,1.0,whole
70,Giant Eagle Life's Getting Fresher Green Beans,12 oz,$3.99,$0.33/oz,False,0.01164021164021164,wt,340.20000000000005,wt
71,Produce Collard Greens,16 oz (avg.),$1.99 avg/ea,$1.99/lb,False,0.004387125220458554,wt,453.6,wt
72,Cut 'N Clean Greens Kale Greens,10 oz,$2.99,$0.30/oz,False,0.010582010582010581,wt,283.5,wt
73,Nature's Basket Organic Power Greens,5 oz,2 for $6.00,$0.60/oz,True,0.021164021164021163,wt,141.75,wt
74,Bolthouse Farms 100% Fruit & Vegetable Juice + Boosts Daily Greens,15.2 oz,2 for $5.00,$0.16/oz,True,0.00564373897707231,wt,56.7,wt
75,CleverFoodies Scramble Leafy Greens,6 oz,$3.49,$0.58/oz,False,0.020458553791887123,wt,170.10000000000002,wt
76,Cut 'N Clean Greens Collard Greens - Cut & Clean,12 oz,$2.99,$0.25/oz,False,0.008818342151675485,wt,340.20000000000005,wt
77,Fresh Organic Collard Greens,2 lb (avg.),$5.98 avg/ea,$2.99/lb,False,0.006591710758377425,wt,907.2,wt
78,Glory Foods Collard Greens - Seasoned Southern Style,27 oz,$1.99,$0.07/oz,False,0.0024691358024691358,wt,765.45,wt
79,Glory Foods Collard Greens - Sensibly Seasoned,14.5 oz,$1.69,$0.12/oz,False,0.004232804232804232,wt,141.75,wt
80,Glory Foods Kale Greens - Organic,10 oz,$3.99,$0.40/oz,False,0.014109347442680775,wt,283.5,wt
81,Glory Foods Kale Greens - Seasoned Southern Style,27 oz,$1.99,$0.07/oz,False,0.0024691358024691358,wt,765.45,wt
82,Glory Foods Mixed Greens - Seasoned Southern Style,27 oz,$1.99,$0.07/oz,False,0.0024691358024691358,wt,765.45,wt
83,Glory Foods Mixed Greens - Sensibly Seasoned,14.5 oz,$1.69,$0.12/oz,False,0.004232804232804232,wt,141.75,wt
84,Glory Foods Mustard Greens - Seasoned Southern Style,27 oz,$1.99,$0.07/oz,False,0.0024691358024691358,wt,765.45,wt
85,Glory Foods Sensibly Seasoned Turnip Greens,15 oz,$1.69,$0.11/oz,False,0.003880070546737213,wt,425.25,wt
86,Glory Foods Turnip Greens,27 oz,$1.99,$0.07/oz,False,0.0024691358024691358,wt,765.45,wt
87,Pictsweet Collard Greens - Chopped,16 oz,4 for $5.00,$0.08/oz,True,0.002821869488536155,wt,453.6,wt
88,Produce Red Onions,14 oz (avg.),$1.74 avg/ea,$1.99/lb,False,0.004387125220458554,wt,396.90000000000003,wt
89,Produce Red Onion Set,16 oz (avg.),$1.49 avg/ea,$1.49/lb,False,0.003284832451499118,wt,453.6,wt
90,Produce Red Peeled Onions,16 oz (avg.),$2.99 avg/ea,$2.99/lb,False,0.006591710758377425,wt,453.6,wt
91,Produce Red Onion,32 oz,$3.99,$0.12/oz,False,0.004232804232804232,wt,907.2,wt
92,Produce Organic Jumbo Red Onion,16 oz,$2.49,$0.16/oz,False,0.00564373897707231,wt,453.6,wt
93,Giant Eagle Diced Red Onion,8 oz,$2.99,$0.37/oz,False,0.013051146384479717,wt,226.8,wt
94,Litehouse Red Onions,17.5 g,$4.99,$0.29/g,False,0.29,whole,17.0,whole
95,Giant Eagle Onion & Garlic Pasta Sauce,24 oz,$1.19,$0.05/oz,False,0.001763668430335097,wt,680.4000000000001,wt
96,Prego® Garden Harvest Tomato Onion & Garlic Italian Sauce,24 oz,$2.19,$0.09/oz,False,0.003174603174603174,wt,680.4000000000001,wt
97,Mids Spaghetti Sauce W/Garlic & Onion,32 oz,$2.99,$0.09/oz,True,0.003174603174603174,wt,907.2,wt
98,Frieda's Pearl Onions - Red,10 oz,$4.49,$0.45/oz,False,0.015873015873015872,wt,283.5,wt
99,"Ragú Chunky Pasta Sauce -Tomato, Garlic & Onion",680 g,$1.89,$0.00/g,False,0.0,whole,680.0,whole
100,"Ragú Chunky Tomato, Garlic & Onion Pasta Sauce",66 oz,$4.99,$0.08/oz,False,0.002821869488536155,wt,1871.1000000000001,wt
101,Ragú Pasta Sauce - Robusto! Sauteed Onion & Garlic,680 g,$1.89,$0.00/g,False,0.0,whole,680.0,whole
0,Del Monte Corn - Whole Kernel Golden Sweet No Salt Added,15.25 oz,3 for $4.00,$0.09/oz,True,0.003174603174603174,wt,708.75,wt
1,Del Monte Golden Sweet Whole Kernel Corn - 50% Less Sodium,15.25 oz,3 for $4.00,$0.09/oz,True,0.003174603174603174,wt,708.75,wt
2,Giant Eagle Golden Sweet Whole Kernel Corn,15.25 oz,$0.49,$0.03/oz,False,0.001058201058201058,wt,708.75,wt
3,Giant Eagle Golden Whole Kernel Corn,15.25 oz,$0.49,$0.03/oz,False,0.001058201058201058,wt,708.75,wt
4,Giant Eagle Whole Kernel Corn,8.5 oz,$0.45,$0.05/oz,False,0.001763668430335097,wt,141.75,wt
5,Orville Redenbacher's Original Kernels,30 oz,$5.29,$0.18/oz,True,0.006349206349206348,wt,850.5,wt
6,Libby's Corn - Organic Sweet Whole Kernel,15 oz,$1.99,$0.13/oz,False,0.004585537918871252,wt,425.25,wt
7,Del Monte Golden Sweet Whole Kernel Corn,15.25 oz,3 for $4.00,$0.09/oz,True,0.003174603174603174,wt,708.75,wt
8,Birds Eye Sweet Kernel Corn,408 g,$1.50,$0.00/g,False,0.0,whole,408.0,whole
9,Del Monte Summer Crisp - Golden Sweet Corn - Whole Kernel,11 oz,3 for $4.00,$0.12/oz,True,0.004232804232804232,wt,311.85,wt
10,Del Monte Corn - Fresh Cut Whole Kernel Golden Sweet,8.75 oz,$1.00,$0.11/oz,False,0.003880070546737213,wt,2126.25,wt
11,Del Monte Corn - Whole Kernel,91.5 oz,$7.49,$0.08/oz,False,0.002821869488536155,wt,141.75,wt
12,Del Monte Corn - Whole Kernel Golden Sweet,29 oz,$1.99,$0.07/oz,False,0.0024691358024691358,wt,822.1500000000001,wt
13,Del Monte Fresh Cut - White Corn - Whole Kernel Sweet,15.25 oz,$1.79,$0.12/oz,False,0.004232804232804232,wt,708.75,wt
14,Del Monte Whole Kernel Corn - Golden Sweet,8.75 oz,$1.00,$0.11/oz,False,0.003880070546737213,wt,2126.25,wt
15,Giant Eagle Golden Whole Kernel Corn,8.5 oz,$0.45,$0.05/oz,False,0.001763668430335097,wt,141.75,wt
16,Giant Eagle Golden Whole Kernel Corn,15.25 oz,$0.49,$0.03/oz,False,0.001058201058201058,wt,708.75,wt
17,Giant Eagle Vac Pac Golden Whole Kernel Corn,12 oz,$0.89,$0.07/oz,False,0.0024691358024691358,wt,340.20000000000005,wt
18,Market District Italian Seasoned Bread Crumbs,24 oz,$1.99,$0.08/oz,False,0.002821869488536155,wt,680.4000000000001,wt
19,4C Bread Crumbs - Panko Seasoned,227 g,$2.19,$0.01/g,False,0.01,whole,227.0,whole
20,Market District Japanese Style Panko Plain Bread Crumbs,13 oz,$1.99,$0.15/oz,False,0.005291005291005291,wt,368.55,wt
21,"Progresso Italian Style Bread Crumbs, 15 oz",15 oz,$2.39,$0.16/oz,False,0.00564373897707231,wt,425.25,wt
22,Market District Plain Bread Crumbs,24 oz,$1.99,$0.08/oz,False,0.002821869488536155,wt,680.4000000000001,wt
23,Progresso Plain Bread Crumbs,15 oz,$2.39,$0.16/oz,False,0.00564373897707231,wt,425.25,wt
24,Goya Bread Crumbs,15 oz,$2.49,$0.17/oz,False,0.00599647266313933,wt,425.25,wt
25,4C Bread Crumbs - Flavored,24 oz,$2.99,$0.12/oz,False,0.004232804232804232,wt,680.4000000000001,wt
26,Aleia's Bread Crumbs - Italian,13 oz,$5.99,$0.46/oz,False,0.016225749559082892,wt,368.55,wt
27,Aleia's Bread Crumbs - Panko,12 oz,$5.99,$0.50/oz,False,0.01763668430335097,wt,340.20000000000005,wt
28,Delallo Bread Crumbs - Italian,15 oz,$2.39,$0.16/oz,False,0.00564373897707231,wt,425.25,wt
29,Kellogg's Bread Crumbs - Corn Flakes,21 oz,$4.79,$0.23/oz,False,0.008112874779541446,wt,595.35,wt
30,Kikkoman Panko Bread Crumbs - Japanese Style,226.8 g,$1.79,$0.01/g,True,0.01,whole,226.0,whole
31,Progresso Garlic & Herb Bread Crumbs,15 oz,$2.39,$0.16/oz,False,0.00564373897707231,wt,425.25,wt
32,"Progresso Italian Style Bread Crumbs, 40 oz",40 oz,$3.99,$0.10/oz,False,0.003527336860670194,wt,1134.0,wt
33,4C Gluten Free Seasoned,12 oz,$3.49,$0.29/oz,False,0.010229276895943561,wt,340.20000000000005,wt
34,Andy's Breading - Chicken Hot N Spicy,10 oz,$2.49,$0.25/oz,False,0.008818342151675485,wt,283.5,wt
35,Andy's Breading - Chicken Mild,10 oz,$2.49,$0.25/oz,False,0.008818342151675485,wt,283.5,wt
36,Gorton's Cod Fillets With Crunchy Panko Breadcrumbs,14.6 oz,$8.99,$0.62/oz,False,0.021869488536155203,wt,170.10000000000002,wt
37,Gorton's Cod Fish Sticks With Crunchy Panko Breadcrumbs,414 g,$8.99,$0.02/g,False,0.02,whole,414.0,whole
38,BelGioioso Cheese - Fresh Mozzarella,8 oz,$4.49,$0.56/oz,True,0.019753086419753086,wt,226.8,wt
39,Giant Eagle Low-Moisture Part-Skim Shredded Mozzarella Cheese,8 oz,$2.19,$0.27/oz,False,0.009523809523809525,wt,226.8,wt
40,Giant Eagle Whole Milk Low-Moisture Shredded Mozzarella Cheese,8 oz,$2.19,$0.27/oz,False,0.009523809523809525,wt,226.8,wt
41,Giant Eagle Shredded Whole Milk Low-Moisture Mozzarella Cheese,16 oz,$4.29,$0.27/oz,False,0.009523809523809525,wt,453.6,wt
42,BelGioioso Cheese - Fresh Mozzarella,16 oz,$6.99,$0.44/oz,True,0.015520282186948852,wt,453.6,wt
43,Giant Eagle Part-Skim Low-Moisture Mozzarella Cheese,8 oz,$1.99,$0.25/oz,False,0.008818342151675485,wt,226.8,wt
44,Sargento Off the Block Mozzarella Traditional Cut Shredded Cheese,8 oz,$3.49,$0.44/oz,False,0.015520282186948852,wt,226.8,wt
45,KRAFT Natural Cheese Shredded Mozzarella,8 oz,$3.49,$0.44/oz,False,0.015520282186948852,wt,226.8,wt
46,Giant Eagle Low-Moisture Part-Skim Shredded Mozzarella Cheese,16 oz,$4.29,$0.27/oz,False,0.009523809523809525,wt,453.6,wt
47,BelGioioso Fresh Mozzarella - Pearls,8 oz,$4.49,$0.56/oz,True,0.019753086419753086,wt,226.8,wt
48,Farm Rich Bites Mozzarella,19.2 oz,$5.99,$0.31/oz,True,0.010934744268077601,wt,56.7,wt
49,Giovanni Rana Tortelloni Chicken Mozzarella,22 oz,$9.99,$0.45/oz,False,0.015873015873015872,wt,623.7,wt
50,Kraft Natural Cheese Shredded Mozzarella with a Touch of Philadelphia,8 oz,$3.49,$0.44/oz,False,0.015520282186948852,wt,226.8,wt
51,Giant Eagle Part-Skim Low-Moisture Sliced Mozzarella Cheese,10 ct,$1.99,$0.20/each,False,0.2,whole,10.0,whole
52,Giant Eagle Low-Moisture Part-Skim Shredded Mozzarella Cheese,32 oz,$5.99,$0.19/oz,False,0.006701940035273368,wt,907.2,wt
53,Giant Eagle Mozzarella Slices,0.25 lb,$6.99/lb,$6.99/lb,False,0.01541005291005291,wt,11340.0,wt
54,Giant Eagle Whole Milk Low-Moisture Shredded Mozzarella Cheese,32 oz,$5.99,$0.19/oz,False,0.006701940035273368,wt,907.2,wt
55,Giant Eagle Shredded Pizza Cheese Blend,8 oz,$2.19,$0.27/oz,False,0.009523809523809525,wt,226.8,wt
56,Sargento Off the Block Shredded Mozzarella & Provolone Cheese,8 oz,$3.49,$0.44/oz,False,0.015520282186948852,wt,226.8,wt
57,Giant Eagle Mozzarella Cheese,0.25 lb,$7.99/lb,$7.99/lb,False,0.01761463844797178,wt,11340.0,wt
58,Giant Eagle Black Beans,15.5 oz,$0.75,$0.05/oz,False,0.001763668430335097,wt,141.75,wt
59,Bush's Best Cannellini Beans,15.5 oz,$1.29,$0.08/oz,False,0.002821869488536155,wt,141.75,wt
60,Giant Eagle Light Red Kidney Beans,15.5 oz,$0.75,$0.05/oz,False,0.001763668430335097,wt,141.75,wt
61,Giant Eagle Life's Getting Fresher Green Beans,12 oz,$3.99,$0.33/oz,False,0.01164021164021164,wt,340.20000000000005,wt
62,Heinz Beans with Tomato Sauce,13.7 oz,$2.99,$0.22/oz,False,0.007760141093474426,wt,198.45000000000002,wt
63,Campbell's® Condensed Bean with Bacon Soup,11.25 oz,$1.99,$0.18/oz,False,0.006349206349206348,wt,708.75,wt
64,Del Monte Green Beans - Cut Blue Lake,14.5 oz,3 for $4.00,$0.09/oz,True,0.003174603174603174,wt,141.75,wt
65,Nature's Basket Organic Black Beans,15 oz,10 for $10.00,$0.07/oz,True,0.0024691358024691358,wt,425.25,wt
66,Old El Paso Traditional Refried Beans,16 oz,$1.69,$0.11/oz,False,0.003880070546737213,wt,453.6,wt
67,Giant Eagle Cut Green Beans,14.5 oz,$0.49,$0.03/oz,False,0.001058201058201058,wt,141.75,wt
68,Bush's Best Black Beans,15 oz,$1.29,$0.09/oz,False,0.003174603174603174,wt,425.25,wt
69,Bush's Best Baked Beans - Homestyle,28 oz,$2.59,$0.09/oz,False,0.003174603174603174,wt,793.8000000000001,wt
70,Bush's Best Baked Beans - Original,28 oz,$2.59,$0.09/oz,False,0.003174603174603174,wt,793.8000000000001,wt
71,Bush's Best Black Beans - Reduced Sodium,15 oz,$1.29,$0.09/oz,False,0.003174603174603174,wt,425.25,wt
72,Birds Eye Green Beans - Cut,1 lb,$1.50,$1.50/lb,False,0.0033068783068783067,wt,453.6,wt
73,Del Monte Green Beans - French Style Blue Lake,14.5 oz,3 for $4.00,$0.09/oz,True,0.003174603174603174,wt,141.75,wt
74,Bush's Best Baked Beans - Original,16 oz,$1.79,$0.11/oz,False,0.003880070546737213,wt,453.6,wt
75,Giant Eagle Dark Red Kidney Beans,15.5 oz,$0.75,$0.05/oz,False,0.001763668430335097,wt,141.75,wt
76,Bush's Best Baked Beans - Homestyle,16 oz,$1.79,$0.11/oz,False,0.003880070546737213,wt,453.6,wt
77,Bush's Best Baked Beans - Vegetarian,28 oz,$2.59,$0.09/oz,False,0.003174603174603174,wt,793.8000000000001,wt
78,Produce Baker Potato,14 oz (avg.),$0.87 avg/ea,$0.99/lb,True,0.0021825396825396826,wt,396.90000000000003,wt
79,Giant Eagle Life's Getting Fresher Restaurant Size Potatoes,5 lb,$4.99,$1.00/lb,False,0.002204585537918871,wt,2268.0,wt
80,Market District Russet Potatoes,10 lb,$4.99,$0.50/lb,False,0.0011022927689594356,wt,4536.0,wt
81,Giant Eagle Sweet Potato,8 oz,$1.50,$0.19/oz,False,0.006701940035273368,wt,226.8,wt
82,Farmer's Market Idaho Russet Potatoes,5 lb,$3.49,$0.70/lb,False,0.0015432098765432098,wt,2268.0,wt
83,Produce Sweet Potato,7 oz (avg.),$0.87 avg/ea,$1.99/lb,False,0.004387125220458554,wt,198.45000000000002,wt
84,Farmer's Market Red Potatoes - Bag,48 oz,$3.99,$0.08/oz,False,0.002821869488536155,wt,1360.8000000000002,wt
85,Sunrise Medley Potatoes,24 each,$3.99,$0.17,False,0.17,whole,24.0,whole
86,Ore-Ida Potatoes - Tater Tots,32 oz,2 for $7.00,$0.11/oz,True,0.003880070546737213,wt,907.2,wt
87,Bob Evans Potatoes - Mashed Original,32 oz,$5.49,$0.17/oz,False,0.00599647266313933,wt,907.2,wt
88,Ore-Ida Potatoes - Crispy Crowns!,850 g,2 for $7.00,$0.00/g,True,0.0,whole,850.0,whole
89,Pik-Nik Potatoes - Shoestring Original,9 oz,$2.99,$0.33/oz,True,0.01164021164021164,wt,255.15,wt
90,Ore-Ida Potatoes - Golden Crinkles French Fried,5 lb,$6.99,$1.40/lb,False,0.0030864197530864196,wt,2268.0,wt
91,Ore-Ida Potatoes - Tater Tots Extra Crispy,28 oz,2 for $7.00,$0.13/oz,True,0.004585537918871252,wt,793.8000000000001,wt
92,Ore-Ida Potatoes - Golden Crinkles French Fried,134 g,$1.50,$0.01/g,False,0.01,whole,134.0,whole
93,Del Monte Potatoes - Whole New,29 oz,$1.99,$0.07/oz,False,0.0024691358024691358,wt,822.1500000000001,wt
94,Ore-Ida Potatoes - Seasoned Crinkles,26 oz,2 for $7.00,$0.13/oz,True,0.004585537918871252,wt,737.1,wt
95,Simply Potatoes Potatoes - Diced w/Onion,20 oz,$2.99,$0.15/oz,False,0.005291005291005291,wt,567.0,wt
96,Giant Eagle Yukon Gold Potatoes,5 lb,$4.99,$1.00/lb,False,0.002204585537918871,wt,2268.0,wt
97,Giant Eagle Red Potatoes,5 lb,$4.99,$1.00/lb,False,0.002204585537918871,wt,2268.0,wt
98,Produce Eggplant,16 oz (avg.),$1.79 avg/ea,$1.79/lb,True,0.0039462081128747795,wt,453.6,wt
99,Produce Baby Eggplant,4 oz (avg.),$1.00 avg/ea,$3.99/lb,False,0.008796296296296297,wt,113.4,wt
100,Produce Green Cabbage,30 oz (avg.),$1.48 avg/ea,$0.79/lb,False,0.0017416225749559084,wt,850.5,wt
101,Produce Brussel Sprouts,0.25 lb,$3.99/lb,$3.99/lb,False,0.008796296296296297,wt,11340.0,wt
102,Produce Red Cabbage,25 oz (avg.),$2.33 avg/ea,$1.49/lb,False,0.003284832451499118,wt,708.75,wt
103,Delallo Eggplant Caponata,6.7 oz,$4.39,$0.66/oz,False,0.02328042328042328,wt,198.45000000000002,wt
104,Dominex Eggplant Cutlets,16 oz,$5.99,$0.37/oz,False,0.013051146384479717,wt,453.6,wt
105,Organic Eggplant Pero,1 ct,$3.99,$3.99/each,False,3.99,whole,1.0,whole
106,Produce Celery Cabbage,30 oz (avg.),$5.61 avg/ea,$2.99/lb,False,0.006591710758377425,wt,850.5,wt
107,Produce Savoy Cabbage,30 oz (avg.),$2.79 avg/ea,$1.49/lb,False,0.003284832451499118,wt,850.5,wt
108,Produce Stem Brussel Sprouts,0.25 lb,$3.99/lb,$3.99/lb,False,0.008796296296296297,wt,11340.0,wt
109,Tasty Bite Punjab Eggplant Dinner,10 oz,$3.49,$0.35/oz,False,0.012345679012345678,wt,283.5,wt
110,McCormick Gourmet Organic Ground Coriander,1.25 oz,$5.99,$4.79/oz,False,0.16895943562610227,wt,708.75,wt
111,McCormick Gourmet Roasted Ground Coriander,1.25 oz,$6.99,$5.59/oz,False,0.19717813051146382,wt,708.75,wt
0,Planters Peanut Oil,1.5 pint,$5.79,$3.86/pint,False,0.008157572171266747,vol,2365.9,vol
1,Spectrum Naturals Peanut Oil,16 fl oz,$9.99,$0.62/fl oz,False,0.02096719648292188,vol,473.12,vol
